<?xml version="1.0" encoding="UTF-8"?>
<!DOCTYPE Chart2D PUBLIC "-//The jCoderZ Project//Chart2D//EN" "chart2d.dtd">
<Chart2D Filename="findings-big.png">
    <LBChart2D>
        <Object2DProperties ObjectTitleText="Findings"/>
        <Chart2DProperties/>
            <GraphChart2DProperties LabelsAxisTitleText="Build"
                NumbersAxisTitleText="Number"
                LabelsAxisTicksAlignment="CENTERED">
            <AxisLabelText max="10" count="20">!.*log.*BUILD_([0-9]*)\.xml</AxisLabelText>
        </GraphChart2DProperties>
        <LegendProperties>
            <LegendLabelsTexts>error</LegendLabelsTexts>
            <LegendLabelsTexts>warning</LegendLabelsTexts>
            <LegendLabelsTexts>info</LegendLabelsTexts>
            <LegendLabelsTexts>coverage</LegendLabelsTexts>
        </LegendProperties>
        <Dataset>
            <Set>
                <Category>
                <Data>!/cruisecontrol/findingsummary/@$z</Data>
                </Category>
            </Set>
         </Dataset>
        <MultiColorsProperties/>
        <GraphProperties
            GraphBarsExistence="false"
            GraphLinesExistence="true"
            GraphLinesThicknessModel="2"
            GraphLinesWithinCategoryOverlapRatio="1f"
            GraphDotsExistence="false"
            GraphDotsThicknessModel="3"
            GraphDotsWithinCategoryOverlapRatio="1f"
            GraphAllowComponentAlignment="true"
            GraphLabelsLinesExistence="true"
            GraphComponentsAlphaComposite="ALPHA_COMPOSITE_MEDIUM"
            GraphNumbersLinesThicknessModel="1"
            />
    </LBChart2D>
</Chart2D>
