<?xml version="1.0" encoding="UTF-8"?>
<!-- Generated from chart2d.dtd by XMLBuddy-->
<!DOCTYPE Chart2D SYSTEM "file:///D:/home/Andreas/projekte/phoenix-2/src/java/org/jcoderz/phoenix/chart2d/chart2d.dtd">
<Chart2D Filename="quality.png">
    <LBChart2D>
        <Object2DProperties ObjectTitleText="Quolity of Component"/>
        <Chart2DProperties/>
        <GraphChart2DProperties LabelsAxisTitleText="Build"
            NumbersAxisTitleText="Number"
            LabelsAxisTicksAlignment="CENTERED">
            <!-- X-Achse !DEFINE MODULUS FOR DISPLAY LABELS!!! -->
            <AxisLabelText max="15" count="15">!.*log.*BUILD_([0-9]*)\.xml</AxisLabelText>
        </GraphChart2DProperties>
        <LegendProperties>
            <!-- Z-Achse -->
            <LegendLabelsTexts>!/cruisecontrol/findingsummary/servicelevelxml/service/@name</LegendLabelsTexts>
        </LegendProperties>
        <Dataset>
            <Set>
                <Category>
<Data>!/cruisecontrol/findingsummary/servicelevelxml/service[@name = '$z']/@quality</Data>
                </Category>
            </Set>
         </Dataset>
        <MultiColorsProperties/>
        <GraphProperties
            GraphBarsExistence="false"
            GraphLinesExistence="true"
            GraphLinesThicknessModel="2"
            GraphLinesWithinCategoryOverlapRatio="1f"
            GraphDotsExistence="false"
            GraphDotsThicknessModel="3"
            GraphDotsWithinCategoryOverlapRatio="1f"
            GraphAllowComponentAlignment="true"
            GraphLabelsLinesExistence="true"
            GraphComponentsAlphaComposite="ALPHA_COMPOSITE_MEDIUM"
            GraphNumbersLinesThicknessModel="1"
            />
    </LBChart2D>
</Chart2D>
